{
 "method_version": "0.1.0",
 "note_zh": "只看标题；一篇论文可以算进几个主题；带条件的写法只在另一个主题也命中时才算。",
 "low_precision": [
  "benchmark",
  "robustness"
 ],
 "topics": [
  {
   "id": "llm",
   "label_zh": "大语言模型",
   "label_en": "LLMs / language models",
   "patterns": [
    "\\bllms?\\b",
    "\\blarge language models?\\b",
    "\\b(?<!vision )(?<!visual )(?<!video )(?<!vision and )(?<!image )language models?\\b",
    "\\blms\\b",
    "\\bslms?\\b",
    "\\bchatgpt\\b",
    "\\bgpt ?[234o]",
    "\\bllama\\b",
    "\\bqwen\\b",
    "\\bdeepseek\\b"
   ]
  },
  {
   "id": "multimodal",
   "label_zh": "多模态 / 视觉-语言",
   "label_en": "Multimodal / vision-language",
   "patterns": [
    "\\bmulti ?modal",
    "\\bcross ?modal",
    "\\bomni ?modal",
    "\\bvision ?(and )?language\\b",
    "\\bvisual ?language\\b",
    "\\bvlms?\\b",
    "\\bmllms?\\b",
    "\\blvlms?\\b",
    "\\blmms?\\b",
    "\\bimage ?text\\b",
    "\\bvisual question answering\\b",
    "\\bvqa\\b",
    "\\bclip\\b",
    "\\baudio ?visual\\b",
    "\\bvision ?language ?action\\b",
    "\\bvlas?\\b"
   ]
  },
  {
   "id": "diffusion",
   "label_zh": "扩散模型 / 流匹配",
   "label_en": "Diffusion / flow-matching models",
   "patterns": [
    "\\bdiffusion\\b",
    "\\bscore ?based (generative|models?|diffusion)",
    "\\bflow matching\\b",
    "\\brectified flows?\\b",
    "\\bconsistency models?\\b"
   ]
  },
  {
   "id": "generation",
   "label_zh": "图像/视频/3D 生成与编辑",
   "label_en": "Image / video / 3D generation & editing",
   "patterns": [
    "\\btext ?to ?(image|video|3d|speech|audio|motion|music)\\b",
    "\\b(image|video|3d|4d|motion|scene|audio|music|speech|human|avatar|layout|texture|shape|face|portrait|talking head|world) (generation|synthesis|editing)\\b",
    "\\bimage editing\\b",
    "\\bvideo editing\\b",
    "\\bgenerative models?\\b",
    "\\bgans?\\b",
    "\\bgenerative adversarial\\b",
    "\\bvaes?\\b",
    "\\bvariational auto ?encoders?\\b",
    "\\bnormali[sz]ing flows?\\b"
   ]
  },
  {
   "id": "rl",
   "label_zh": "强化学习",
   "label_en": "Reinforcement learning",
   "patterns": [
    "\\breinforcement learning\\b",
    "\\brl\\b",
    "\\bmarl\\b",
    "\\brlhf\\b",
    "\\brlvr\\b",
    "\\bgrpo\\b",
    "\\bppo\\b",
    "\\bq ?learning\\b",
    "\\bpolicy gradients?\\b",
    "\\bpolicy optimi[sz]ation\\b",
    "\\bactor ?critic\\b",
    "\\boffline rl\\b",
    "\\bmarkov decision process",
    "\\bmdps?\\b"
   ]
  },
  {
   "id": "agents",
   "label_zh": "智能体",
   "label_en": "Agents (LLM / RL / multi-agent)",
   "patterns": [
    "\\bagents?\\b",
    "\\bagentic\\b",
    "\\bmulti ?agent\\b"
   ]
  },
  {
   "id": "3d",
   "label_zh": "3D 视觉（NeRF/高斯泼溅/点云）",
   "label_en": "3D vision (NeRF / Gaussian splatting / point clouds)",
   "patterns": [
    "\\b3d\\b",
    "\\b4d\\b",
    "\\bgaussian splatting\\b",
    "\\b3dgs\\b",
    "\\bgaussians\\b",
    "\\bnerfs?\\b",
    "\\bneural radiance fields?\\b",
    "\\bradiance fields?\\b",
    "\\bpoint clouds?\\b",
    "\\bnovel view synthesis\\b",
    "\\bmesh(es)?\\b",
    "\\bdepth estimation\\b",
    "\\bmonocular depth\\b",
    "\\bstereo\\b",
    "\\bslam\\b",
    "\\bsurface reconstruction\\b",
    "\\bstructure from motion\\b",
    "\\bmulti ?view (stereo|reconstruction|3d|geometry|diffusion|generation|synthesis|consistent|consistency)\\b"
   ]
  },
  {
   "id": "gs_nerf",
   "label_zh": "高斯泼溅 / NeRF",
   "label_en": "Gaussian splatting / NeRF (neural rendering)",
   "patterns": [
    "\\bgaussian splatting\\b",
    "\\b3dgs\\b",
    "\\bgaussians\\b",
    "\\bnerfs?\\b",
    "\\bneural radiance fields?\\b",
    "\\bradiance fields?\\b",
    "\\bneural rendering\\b",
    "\\bnovel view synthesis\\b"
   ]
  },
  {
   "id": "safety_alignment",
   "label_zh": "安全与对齐",
   "label_en": "Safety & alignment",
   "patterns": [
    "\\bsafety\\b",
    "\\bsafe\\b",
    "\\bjailbreak",
    "\\bred ?teaming\\b",
    "\\brlhf\\b",
    "\\bdpo\\b",
    "\\bpreference (optimi[sz]ation|learning|alignment|data|feedback)\\b",
    "\\bharmful\\b",
    "\\bharmless",
    "\\bguardrails?\\b",
    "\\btrustworth",
    "\\bsuperalignment\\b",
    "\\bmisalign",
    "\\breward (model|hacking)",
    "\\balign(ment|ing|ed)?\\b  [only if topic 'llm' also matches]",
    "\\balign(ment|ing|ed)?\\b  [only if topic 'multimodal' also matches]",
    "\\balign(ment|ing|ed)?\\b  [only if topic 'agents' also matches]"
   ]
  },
  {
   "id": "reasoning",
   "label_zh": "推理（思维链/数学）",
   "label_en": "Reasoning (CoT / math)",
   "patterns": [
    "\\breasoning\\b",
    "\\breasoners?\\b",
    "\\bchain ?of ?thoughts?\\b",
    "\\bcot\\b",
    "\\bmath\\b",
    "\\bmathematical\\b",
    "\\btheorem proving\\b",
    "\\bthinking\\b"
   ]
  },
  {
   "id": "video",
   "label_zh": "视频",
   "label_en": "Video",
   "patterns": [
    "\\bvideos?\\b"
   ]
  },
  {
   "id": "graph",
   "label_zh": "图学习 / GNN",
   "label_en": "Graphs / GNNs",
   "patterns": [
    "\\bgraphs?\\b",
    "\\bgnns?\\b",
    "\\bgcns?\\b",
    "\\bmessage passing\\b",
    "\\bnode classification\\b",
    "\\blink prediction\\b",
    "\\bhypergraphs?\\b"
   ]
  },
  {
   "id": "transformer",
   "label_zh": "Transformer / 注意力",
   "label_en": "Transformers / attention",
   "patterns": [
    "\\btransformers?\\b",
    "\\battention\\b",
    "\\bvits?\\b"
   ]
  },
  {
   "id": "ssm",
   "label_zh": "状态空间模型 / Mamba",
   "label_en": "State-space models / Mamba",
   "patterns": [
    "\\bmamba\\b",
    "\\bstate ?space models?\\b",
    "\\bssms?\\b",
    "\\blinear attention\\b"
   ]
  },
  {
   "id": "rag_retrieval",
   "label_zh": "检索 / 检索增强生成",
   "label_en": "Retrieval / RAG",
   "patterns": [
    "\\bretrieval\\b",
    "\\bretrieval ?augmented\\b",
    "\\brag\\b",
    "\\bretrievers?\\b"
   ]
  },
  {
   "id": "efficiency",
   "label_zh": "高效化（量化/剪枝/蒸馏/KV 缓存）",
   "label_en": "Efficiency (quantisation / pruning / distillation / KV cache)",
   "patterns": [
    "\\bquantiz",
    "\\bquantis",
    "\\bpruning\\b",
    "\\bprun(e|ed)\\b",
    "\\bsparsit",
    "\\b(model|kv|token|context|prompt|network|llm|weight|activation|cache|gradient|vision token|visual token)s? compression\\b",
    "\\bcompress(ing|ed)? (the )?(llms?|large|models?|neural|kv|tokens?|context|prompts?|networks?|transformers?|weights?)\\b",
    "\\bsparse (attention|training|moe|models?|networks?|llms?|fine ?tuning|mixture|activation|transformers?|experts?)\\b",
    "\\b(?<!dataset )(?<!data )distill",
    "\\bkv ?cache\\b",
    "\\bspeculative decoding\\b",
    "\\baccelerat\\w* (\\w+ ){0,2}(llms?|inference|training|decoding|diffusion|generation|sampling|models?|transformers?|attention|serving|reasoning)\\b",
    "\\btoken (pruning|merging|reduction|compression)\\b",
    "\\befficient (inference|training|fine ?tuning|llms?|transformers?|attention|serving|decoding|generation|video|reasoning)\\b"
   ]
  },
  {
   "id": "finetuning",
   "label_zh": "微调 / 参数高效 / 后训练",
   "label_en": "Fine-tuning / PEFT / post-training",
   "patterns": [
    "\\bfine ?tun",
    "\\bfinetun",
    "\\binstruction ?tun",
    "\\bparameter ?efficient\\b",
    "\\bpeft\\b",
    "\\blora\\b",
    "\\badapters?\\b",
    "\\bprompt tuning\\b",
    "\\bpost ?training\\b",
    "\\bsft\\b"
   ]
  },
  {
   "id": "icl_prompting",
   "label_zh": "上下文学习 / 提示",
   "label_en": "In-context learning / prompting",
   "patterns": [
    "\\bin ?context\\b",
    "\\bicl\\b",
    "\\bprompt",
    "\\bfew ?shot prompting\\b"
   ]
  },
  {
   "id": "robustness",
   "label_zh": "鲁棒性与对抗攻击",
   "label_en": "Robustness & adversarial attacks",
   "patterns": [
    "\\badversarial",
    "\\brobust",
    "\\bbackdoor",
    "\\bpoisoning\\b",
    "\\battacks?\\b",
    "\\bcertified\\b"
   ]
  },
  {
   "id": "privacy",
   "label_zh": "隐私 / 机器遗忘",
   "label_en": "Privacy / unlearning",
   "patterns": [
    "\\bprivacy\\b",
    "\\bprivate\\b",
    "\\bdifferential(ly)? priva",
    "\\bmembership inference\\b",
    "\\bunlearning\\b"
   ]
  },
  {
   "id": "federated",
   "label_zh": "联邦学习",
   "label_en": "Federated learning",
   "patterns": [
    "\\bfederated\\b"
   ]
  },
  {
   "id": "interpretability",
   "label_zh": "可解释性",
   "label_en": "Interpretability / explainability",
   "patterns": [
    "\\binterpretab",
    "\\bexplainab",
    "\\bexplanations?\\b",
    "\\bmechanistic\\b",
    "\\bsparse auto ?encoders?\\b",
    "\\bsaes?\\b",
    "\\bcircuits?\\b",
    "\\bprobing\\b",
    "\\bsaliency\\b",
    "\\bconcept (bottleneck|based|activation)"
   ]
  },
  {
   "id": "hallucination",
   "label_zh": "幻觉与事实性",
   "label_en": "Hallucination & factuality",
   "patterns": [
    "\\bhallucinat",
    "\\bfactual",
    "\\bfact ?check",
    "\\bmisinformation\\b",
    "\\bfaithful"
   ]
  },
  {
   "id": "benchmark",
   "label_zh": "基准、数据集与评测",
   "label_en": "Benchmarks, datasets & evaluation",
   "patterns": [
    "\\bbenchmark",
    "\\bdatasets?\\b",
    "\\bevaluat",
    "\\bleaderboards?\\b",
    "\\bcorpus\\b",
    "\\bcorpora\\b"
   ]
  },
  {
   "id": "self_supervised",
   "label_zh": "自监督 / 对比 / 表征学习",
   "label_en": "Self-supervised / contrastive / representation learning",
   "patterns": [
    "\\bself ?supervis",
    "\\bcontrastive\\b",
    "\\bmasked (image|auto ?encoders?|modell?ing)\\b",
    "\\brepresentation learning\\b"
   ]
  },
  {
   "id": "continual",
   "label_zh": "持续学习",
   "label_en": "Continual learning",
   "patterns": [
    "\\bcontinual\\b",
    "\\blifelong\\b",
    "\\bincremental learning\\b",
    "\\bclass ?incremental\\b",
    "\\bcatastrophic forgetting\\b"
   ]
  },
  {
   "id": "ood",
   "label_zh": "分布偏移 / 分布外 / 域适应",
   "label_en": "Distribution shift / OOD / domain adaptation",
   "patterns": [
    "\\bout ?of ?distribution\\b",
    "\\bood\\b",
    "\\bdomain (adaptation|generali[sz]ation|shifts?)\\b",
    "\\bdistribution(al)? shifts?\\b",
    "\\btest ?time (adaptation|training)\\b",
    "\\bsource ?free\\b",
    "\\banomal"
   ]
  },
  {
   "id": "theory_optim",
   "label_zh": "优化与学习理论",